Enhancement Name,Enhancement Description,Enhancement Price
Shipping Insurance,Guarantees your shipment is fully covered and supported from checkout to delivery,3.99
Donations,Give back effortlessly by adding a $1 donation to support a featured cause at checkout,1.00
Gift Wrapping,Have your order wrapped and ready to impress with premium paper and presentation,10.00
Damage Protection,Covers accidental damage after delivery so you’re never left with a broken product,2.99
Express Packaging,Move to the front of the line with faster packing and priority shipping on your order,4.99
Extended Returns,Enjoy extra flexibility with an extended return window for stress-free shopping,3.99
Carbon Offset,Balance out your delivery’s carbon footprint with verified environmental offsets,1.50